{
  "schema_version": "openmed.reference_deployment.v1",
  "release": "3.4",
  "objective_evidence": "unmeasured_targets",
  "reference_topology": "compose_single_host",
  "topologies": [
    {
      "id": "compose_single_host",
      "status": "reference",
      "summary": "Offline single-host Compose bundle: bundled PostgreSQL, one-shot migration, Journey worker, REST API, optional smoke and MCP profiles on an internal network. Only the REST port is published, bound to loopback by default.",
      "services": [
        "postgres",
        "journey_migrate",
        "journey_worker",
        "rest_api",
        "journey_golden",
        "mcp_server"
      ],
      "references": {
        "manifests": [
          {
            "path": "deploy/openmed-compose.yaml",
            "compose_services": [
              "postgres",
              "journey-migrate",
              "journey-worker",
              "openmed",
              "journey-golden",
              "mcp"
            ],
            "compose_volumes": [
              "openmed-cache",
              "openmed-models",
              "openmed-postgres"
            ]
          },
          {
            "path": "deploy/docker/Dockerfile.distroless"
          }
        ],
        "docs": [
          "docs/deploy/self-hosted-compose.md",
          "docs/deploy/hardened-image.md"
        ]
      }
    },
    {
      "id": "helm_kubernetes",
      "status": "supported",
      "summary": "Helm chart for one namespace: one REST replica by default, opt-in Journey profile with a migration Job, a worker Deployment, an artifact claim, and an operator-provided external PostgreSQL referenced through a Secret.",
      "services": [
        "rest_api",
        "journey_migrate",
        "journey_worker",
        "postgres"
      ],
      "references": {
        "manifests": [
          {
            "path": "deploy/helm/openmed-service/Chart.yaml"
          },
          {
            "path": "deploy/helm/openmed-service/values.yaml",
            "helm_values": [
              "replicaCount",
              "persistence.enabled",
              "journey.enabled",
              "journey.worker.replicas",
              "journey.database.secretName",
              "journey.networkPolicy.enabled"
            ]
          },
          {
            "path": "deploy/helm/openmed-service/templates/deployment.yaml"
          },
          {
            "path": "deploy/helm/openmed-service/templates/network-policy.yaml"
          }
        ],
        "docs": [
          "docs/deploy/helm.md"
        ]
      }
    },
    {
      "id": "kubernetes_autoscaled",
      "status": "supported",
      "summary": "Horizontal autoscaling of the REST Deployment from queue depth, in-flight requests and CPU. Supported for synchronous routes only; process-local job state does not follow a request across replicas.",
      "services": [
        "rest_api"
      ],
      "references": {
        "manifests": [
          {
            "path": "deploy/k8s/hpa.yaml"
          }
        ],
        "docs": [
          "docs/deploy/autoscaling.md"
        ]
      }
    },
    {
      "id": "kubernetes_model_operator",
      "status": "supported",
      "summary": "Operator that pins the served model version of an existing REST Deployment and rolls it out or back. It changes no storage, transport or autoscaling behavior.",
      "services": [
        "rest_api"
      ],
      "references": {
        "modules": [
          "deploy.operator.openmed_operator"
        ],
        "manifests": [
          {
            "path": "deploy/operator/kustomization.yaml"
          },
          {
            "path": "deploy/operator/crd/openmedmodel.yaml"
          }
        ],
        "docs": [
          "docs/deploy/operator.md"
        ]
      }
    },
    {
      "id": "development_compose",
      "status": "unsupported",
      "summary": "Repository-root Compose file for local development. It publishes the REST port on every interface without authentication, has no Journey store, and is not a production topology.",
      "services": [
        "rest_api",
        "mcp_server"
      ],
      "references": {
        "manifests": [
          {
            "path": "docker-compose.yml",
            "compose_services": [
              "app",
              "mcp"
            ]
          },
          {
            "path": "Dockerfile"
          },
          {
            "path": "Dockerfile.mcp"
          }
        ]
      }
    }
  ],
  "services": [
    {
      "id": "rest_api",
      "summary": "FastAPI REST service started through the PHI-safe logging launcher, with the GraphQL router mounted on the same listener.",
      "replica_modes": [
        {
          "mode": "single",
          "status": "reference",
          "constraint_codes": []
        },
        {
          "mode": "horizontal",
          "status": "restricted",
          "constraint_codes": [
            "synchronous_routes_only",
            "per_replica_warm_pool",
            "per_replica_rate_limits",
            "per_replica_job_state"
          ],
          "references": {
            "manifests": [
              {
                "path": "deploy/k8s/hpa.yaml"
              }
            ]
          }
        }
      ],
      "references": {
        "modules": [
          "openmed.service.app:create_app",
          "openmed.service.logging:main"
        ],
        "routes": [
          {
            "surface": "rest",
            "method": "GET",
            "path": "/livez"
          },
          {
            "surface": "rest",
            "method": "GET",
            "path": "/readyz"
          },
          {
            "surface": "rest",
            "method": "GET",
            "path": "/health"
          },
          {
            "surface": "rest",
            "method": "POST",
            "path": "/analyze"
          },
          {
            "surface": "rest",
            "method": "POST",
            "path": "/pii/extract"
          },
          {
            "surface": "rest",
            "method": "POST",
            "path": "/pii/deidentify"
          },
          {
            "surface": "rest",
            "method": "POST",
            "path": "/pii/deidentify/stream"
          }
        ],
        "manifests": [
          {
            "path": "deploy/openmed-compose.yaml",
            "compose_services": [
              "openmed"
            ]
          },
          {
            "path": "deploy/helm/openmed-service/templates/deployment.yaml"
          },
          {
            "path": "deploy/helm/openmed-service/templates/service.yaml"
          }
        ],
        "docs": [
          "docs/rest-service.md"
        ]
      }
    },
    {
      "id": "journey_worker",
      "summary": "Journey readiness worker. It refreshes value-free store and artifact probes and serves them over an internal health listener; it does not process jobs.",
      "replica_modes": [
        {
          "mode": "single",
          "status": "reference",
          "constraint_codes": [
            "health_probe_only"
          ]
        }
      ],
      "references": {
        "modules": [
          "openmed.deploy.journey:main",
          "openmed.deploy.journey:probe_deployment"
        ],
        "routes": [
          {
            "surface": "journey_worker",
            "method": "GET",
            "path": "/livez"
          },
          {
            "surface": "journey_worker",
            "method": "GET",
            "path": "/readyz"
          },
          {
            "surface": "journey_worker",
            "method": "GET",
            "path": "/healthz"
          }
        ],
        "manifests": [
          {
            "path": "deploy/openmed-compose.yaml",
            "compose_services": [
              "journey-worker"
            ]
          },
          {
            "path": "deploy/helm/openmed-service/templates/journey-worker.yaml"
          }
        ]
      }
    },
    {
      "id": "journey_migrate",
      "summary": "One-shot, checksum-verified additive Journey schema migration that gates the worker and API start.",
      "replica_modes": [
        {
          "mode": "one_shot",
          "status": "reference",
          "constraint_codes": [
            "single_migration_runner",
            "completes_before_api_and_worker"
          ]
        }
      ],
      "references": {
        "modules": [
          "openmed.deploy.journey:run_migrations"
        ],
        "manifests": [
          {
            "path": "deploy/openmed-compose.yaml",
            "compose_services": [
              "journey-migrate"
            ]
          },
          {
            "path": "deploy/helm/openmed-service/templates/journey-migration-job.yaml"
          }
        ]
      }
    },
    {
      "id": "journey_golden",
      "summary": "One-shot synthetic golden journey used as a post-start and post-restore smoke check.",
      "replica_modes": [
        {
          "mode": "one_shot",
          "status": "supported",
          "constraint_codes": [
            "smoke_profile_only",
            "synthetic_content_only"
          ]
        }
      ],
      "references": {
        "modules": [
          "openmed.deploy.journey:run_golden_journey"
        ],
        "manifests": [
          {
            "path": "deploy/openmed-compose.yaml",
            "compose_services": [
              "journey-golden"
            ]
          }
        ]
      }
    },
    {
      "id": "mcp_server",
      "summary": "MCP server. Standard input and output is the default; the Compose profile runs stateless streamable HTTP on the internal network only.",
      "replica_modes": [
        {
          "mode": "single",
          "status": "supported",
          "constraint_codes": [
            "optional_profile"
          ]
        }
      ],
      "references": {
        "modules": [
          "openmed.mcp.server:create_mcp_server",